{
  "$schema": "schemas/model-card-index.schema.json",
  "schema_version": 1,
  "kind": "amesh.model-card-index",
  "authority": "display_only",
  "generated_at": "2026-10-04T01:02:36Z",
  "repository": "https://github.com/byollm/modelcards",
  "cards": [
    {
      "id": "qwen3.6-27b",
      "name": "Qwen 3.6 27B",
      "path": "cards/qwen3.6-27b.json",
      "sha256": "94020d2d4660179d9e651dc2407cf264eddc366259b30749480ba4c8c897e380",
      "model_type": "dense",
      "display": {
        "type_symbol": "square.stack.3d.up",
        "capability_symbols": {
          "chat": "bubble.left.and.bubble.right",
          "speculation": "bolt.fill",
          "streaming": "waveform",
          "thinking": "point.3.connected.trianglepath.dotted",
          "tools": "wrench.and.screwdriver"
        }
      },
      "amesh_profile_ids": [
        "yukon-qwen3_6-27b-mixed4bit"
      ]
    },
    {
      "id": "qwen3.8-27b",
      "name": "Qwen 3.8 27B",
      "path": "cards/qwen3.8-27b.json",
      "sha256": "650658f5dea3ea4e8cb6fe185e864d97186810eb00656d4b00da323b5bde1b26",
      "model_type": "dense",
      "display": {
        "type_symbol": "square.stack.3d.up",
        "capability_symbols": {
          "chat": "bubble.left.and.bubble.right",
          "speculation": "bolt.fill",
          "streaming": "waveform",
          "thinking": "point.3.connected.trianglepath.dotted",
          "tools": "wrench.and.screwdriver"
        }
      },
      "amesh_profile_ids": [
        "yukon-qwen3_8-27b-4bit"
      ]
    }
  ]
}
